{
  "decision": "allow",
  "campaign_id": "campaign-local-001",
  "session_id": "session-sq02-local-001",
  "strategy_contract_id": "SQ02_DOWNSIDE_CONT_V0",
  "reasons": ["allow:order_position_campaign_caps_passed"],
  "owner_fixed_caps_used": {
    "risk_capital": "1000",
    "max_order_loss": "25",
    "max_campaign_loss": "100",
    "max_notional": "500",
    "max_leverage": 3,
    "profit_protect_threshold": "80"
  },
  "planned_order": {
    "symbol": "ETH/USDT:USDT",
    "side": "SHORT",
    "notional": "300",
    "leverage": 2,
    "max_loss": "20",
    "order_type": "simulated_market"
  },
  "protection_requirements": [
    "protective_stop_required",
    "position_lifecycle_monitor_required",
    "campaign_loss_lock_required"
  ],
  "rollback_and_cancellation": "local_plan_only_no_exchange_side_effect"
}
